Microsoft Windows [Version 10.0.17763.503]
(c) 2018 Microsoft Corporation. All rights reserved.

C:\Users\priyanka>cd ..

C:\Users>cd ..

C:\>cd xampp

C:\xampp>cd mqsql
The system cannot find the path specified.

C:\xampp>cd mysql

C:\xampp\mysql>cd bin

C:\xampp\mysql\bin>mysql
Welcome to the MariaDB monitor.  Commands end with ; or \g.
Your MariaDB connection id is 270
Server version: 10.1.40-MariaDB mariadb.org binary distribution

Copyright (c) 2000, 2018, Oracle, MariaDB Corporation Ab and others.

Type 'help;' or '\h' for help. Type '\c' to clear the current input statement.

MariaDB [(none)]>
MariaDB [(none)]> mysql -u root
    -> exit
    -> exit
    -> Bye

C:\xampp\mysql\bin>mysql -u root
Welcome to the MariaDB monitor.  Commands end with ; or \g.
Your MariaDB connection id is 271
Server version: 10.1.40-MariaDB mariadb.org binary distribution

Copyright (c) 2000, 2018, Oracle, MariaDB Corporation Ab and others.

Type 'help;' or '\h' for help. Type '\c' to clear the current input statement.

MariaDB [(none)]> show databases;
+--------------------+
| Database           |
+--------------------+
| information_schema |
| mysql              |
| performance_schema |
| phpmyadmin         |
| priya              |
| priyanka           |
| test               |
+--------------------+
7 rows in set (0.00 sec)

MariaDB [(none)]> CREATE DATABASE<cats>;
ERROR 1064 (42000): You have an error in your SQL syntax; check the manual that corresponds to your MariaDB server version for the right syntax to use near '<cats>' at line 1
MariaDB [(none)]> CREATE DATABASE cats;
Query OK, 1 row affected (0.00 sec)

MariaDB [(none)]> CREATE DATABASE <cats>;
ERROR 1064 (42000): You have an error in your SQL syntax; check the manual that corresponds to your MariaDB server version for the right syntax to use near '<cats>' at line 1
MariaDB [(none)]> CREATE DATABASE cats;
ERROR 1007 (HY000): Can't create database 'cats'; database exists
MariaDB [(none)]> CREATE DATABASE priya;
ERROR 1007 (HY000): Can't create database 'priya'; database exists
MariaDB [(none)]> CREATE DATABASE asha;
Query OK, 1 row affected (0.00 sec)

MariaDB [(none)]> CREATE DATABASE asha;
ERROR 1007 (HY000): Can't create database 'asha'; database exists
MariaDB [(none)]> CREATE DATABASE asha_ff;
Query OK, 1 row affected (0.00 sec)

MariaDB [(none)]> show databases
    -> ;
+--------------------+
| Database           |
+--------------------+
| asha               |
| asha_ff            |
| cats               |
| information_schema |
| mysql              |
| performance_schema |
| phpmyadmin         |
| priya              |
| priyanka           |
| test               |
+--------------------+
10 rows in set (0.00 sec)

MariaDB [(none)]> drop databases test;
ERROR 1064 (42000): You have an error in your SQL syntax; check the manual that corresponds to your MariaDB server version for the right syntax to use near 'databases test' at line 1
MariaDB [(none)]> drop database asha;
Query OK, 0 rows affected (0.00 sec)

MariaDB [(none)]> show databeses;
ERROR 1064 (42000): You have an error in your SQL syntax; check the manual that corresponds to your MariaDB server version for the right syntax to use near 'databeses' at line 1
MariaDB [(none)]> show databases;
+--------------------+
| Database           |
+--------------------+
| asha_ff            |
| cats               |
| information_schema |
| mysql              |
| performance_schema |
| phpmyadmin         |
| priya              |
| priyanka           |
| test               |
+--------------------+
9 rows in set (0.00 sec)

MariaDB [(none)]> CREATE TABLE cats
    -> (
    -> name VARCHAR(100),
    -> age INT,
    -> breed VARCHAR(100)
    -> };
ERROR 1046 (3D000): No database selected
MariaDB [(none)]> CREATE TABLE cats
    -> (
    -> use
    -> Bye

C:\xampp\mysql\bin>use cats
'use' is not recognized as an internal or external command,
operable program or batch file.

C:\xampp\mysql\bin>USE cats
'USE' is not recognized as an internal or external command,
operable program or batch file.

C:\xampp\mysql\bin>cd bin
The system cannot find the path specified.

C:\xampp\mysql\bin>mysql
Welcome to the MariaDB monitor.  Commands end with ; or \g.
Your MariaDB connection id is 272
Server version: 10.1.40-MariaDB mariadb.org binary distribution

Copyright (c) 2000, 2018, Oracle, MariaDB Corporation Ab and others.

Type 'help;' or '\h' for help. Type '\c' to clear the current input statement.

MariaDB [(none)]> USE cats
ERROR 1044 (42000): Access denied for user ''@'localhost' to database 'cats'
MariaDB [(none)]> USE cats;
ERROR 1044 (42000): Access denied for user ''@'localhost' to database 'cats'
MariaDB [(none)]> USE CATS
ERROR 1044 (42000): Access denied for user ''@'localhost' to database 'cats'
MariaDB [(none)]> Bye

C:\xampp\mysql\bin>MYSQL -U ROOT
ERROR 1044 (42000): Access denied for user ''@'localhost' to database 'root'

C:\xampp\mysql\bin>mysql -u root
Welcome to the MariaDB monitor.  Commands end with ; or \g.
Your MariaDB connection id is 276
Server version: 10.1.40-MariaDB mariadb.org binary distribution

Copyright (c) 2000, 2018, Oracle, MariaDB Corporation Ab and others.

Type 'help;' or '\h' for help. Type '\c' to clear the current input statement.

MariaDB [(none)]> use cats
Database changed
MariaDB [cats]> create table cats;
ERROR 1113 (42000): A table must have at least 1 column
MariaDB [cats]> CREATE TABLE cats;
ERROR 1113 (42000): A table must have at least 1 column
MariaDB [cats]> CREATE TABLE cats
    -> ;
ERROR 1113 (42000): A table must have at least 1 column
MariaDB [cats]> create table cats
    -> {
    -> name VARCHAR(100)
    -> breed VARCHAR(100),
    -> age INT
    -> );
ERROR 1064 (42000): You have an error in your SQL syntax; check the manual that corresponds to your MariaDB server version for the right syntax to use near '{
name VARCHAR(100)
breed VARCHAR(100),
age INT
)' at line 2
MariaDB [cats]> CREATE TABLES cats
    -> (
    -> name VARCHAR(100),
    -> age INT,
    -> breed VARCHAR(100)
    -> );
ERROR 1064 (42000): You have an error in your SQL syntax; check the manual that corresponds to your MariaDB server version for the right syntax to use near 'TABLES cats
(
name VARCHAR(100),
age INT,
breed VARCHAR(100)
)' at line 1
MariaDB [cats]> CREATE TABLE cats
    -> (
    -> NAME VARCHAR(100),
    -> AGE INT,
    -> BREED VARCHAR(100)
    -> );
Query OK, 0 rows affected (0.15 sec)

MariaDB [cats]> SHOW COLOMNS FROM cats;
ERROR 1064 (42000): You have an error in your SQL syntax; check the manual that corresponds to your MariaDB server version for the right syntax to use near 'COLOMNS FROM cats' at line 1
MariaDB [cats]> SHOW COLOMNS FROM cats;
ERROR 1064 (42000): You have an error in your SQL syntax; check the manual that corresponds to your MariaDB server version for the right syntax to use near 'COLOMNS FROM cats' at line 1
MariaDB [cats]> show table;
ERROR 1064 (42000): You have an error in your SQL syntax; check the manual that corresponds to your MariaDB server version for the right syntax to use near '' at line 1
MariaDB [cats]> show tables;
+----------------+
| Tables_in_cats |
+----------------+
| cats           |
+----------------+
1 row in set (0.00 sec)

MariaDB [cats]> INSERT INTO cats(name,age)
    -> VALUES (12,'victoria');
Query OK, 1 row affected, 1 warning (0.05 sec)

MariaDB [cats]> show tables;
+----------------+
| Tables_in_cats |
+----------------+
| cats           |
+----------------+
1 row in set (0.00 sec)

MariaDB [cats]> select*from cats;
+------+------+-------+
| NAME | AGE  | BREED |
+------+------+-------+
| 12   |    0 | NULL  |
+------+------+-------+
1 row in set (0.00 sec)

MariaDB [cats]> desc cats;
+-------+--------------+------+-----+---------+-------+
| Field | Type         | Null | Key | Default | Extra |
+-------+--------------+------+-----+---------+-------+
| NAME  | varchar(100) | YES  |     | NULL    |       |
| AGE   | int(11)      | YES  |     | NULL    |       |
| BREED | varchar(100) | YES  |     | NULL    |       |
+-------+--------------+------+-----+---------+-------+
3 rows in set (0.01 sec)

MariaDB [cats]> show colomns from cats;
ERROR 1064 (42000): You have an error in your SQL syntax; check the manual that corresponds to your MariaDB server version for the right syntax to use near 'colomns from cats' at line 1
MariaDB [cats]> INSERT INTO cats(name,age)
    -> VALUES('charlie',12)
    ->
    -> ;
Query OK, 1 row affected (0.04 sec)

MariaDB [cats]> CREATE TABLE people(
    -> first_name VARCHAR(20),
    -> last_name VARCHAR(20),
    -> age INT
    -> );
Query OK, 0 rows affected (0.27 sec)

MariaDB [cats]> show columns from people;
+------------+-------------+------+-----+---------+-------+
| Field      | Type        | Null | Key | Default | Extra |
+------------+-------------+------+-----+---------+-------+
| first_name | varchar(20) | YES  |     | NULL    |       |
| last_name  | varchar(20) | YES  |     | NULL    |       |
| age        | int(11)     | YES  |     | NULL    |       |
+------------+-------------+------+-----+---------+-------+
3 rows in set (0.01 sec)

MariaDB [cats]> INSERT INTO people(first_name,last_name,age)
    -> values(priya,reddy,20);
ERROR 1054 (42S22): Unknown column 'priya' in 'field list'
MariaDB [cats]> insert into people(first_name,last_name,age)
    -> values(diya,reddy,3),(tina,reddy,6),(hia,eina,7);
ERROR 1054 (42S22): Unknown column 'diya' in 'field list'
MariaDB [cats]> insert into people(first_name,last_name,age)
    -> values('diya','reddy',3),('tina','reddy',6),('hia','ein',7);
Query OK, 3 rows affected (0.03 sec)
Records: 3  Duplicates: 0  Warnings: 0

MariaDB [cats]> show tables;
+----------------+
| Tables_in_cats |
+----------------+
| cats           |
| people         |
+----------------+
2 rows in set (0.00 sec)

MariaDB [cats]> show columns from people;
+------------+-------------+------+-----+---------+-------+
| Field      | Type        | Null | Key | Default | Extra |
+------------+-------------+------+-----+---------+-------+
| first_name | varchar(20) | YES  |     | NULL    |       |
| last_name  | varchar(20) | YES  |     | NULL    |       |
| age        | int(11)     | YES  |     | NULL    |       |
+------------+-------------+------+-----+---------+-------+
3 rows in set (0.01 sec)

MariaDB [cats]> select*from people;
+------------+-----------+------+
| first_name | last_name | age  |
+------------+-----------+------+
| diya       | reddy     |    3 |
| tina       | reddy     |    6 |
| hia        | ein       |    7 |
+------------+-----------+------+
3 rows in set (0.00 sec)

MariaDB [cats]> create table employees
    -> (id IN NOT NULL  AUTO_INCREMENT,
    -> last_name VARCHAR(255) NOT NULL,
    -> first_name VARCHAR(255) NOT NULL,
    -> middile_name VARCHAR(255),
    -> age INTEGER NOT NULL,
    -> current_status VARCHAR(100) NOT NULL DEFAULT'employed',
    -> PRIMARY KEY(id)
    -> );
ERROR 1064 (42000): You have an error in your SQL syntax; check the manual that corresponds to your MariaDB server version for the right syntax to use near 'IN NOT NULL  AUTO_INCREMENT,
last_name VARCHAR(255) NOT NULL,
first_name VARCHAR' at line 2
MariaDB [cats]> create table employees
    -> (id INT NOT NULL AUTO_INCREMENT,
    -> first_name VARCHAR(255) NOT NULL,
    -> last_name VARCHAR(255) NOT NULL,
    -> middile_name VARCHAR(255),
    -> middile_name VARCHAR(255),
    -> first_name VARCHAR(255;
ERROR 1064 (42000): You have an error in your SQL syntax; check the manual that corresponds to your MariaDB server version for the right syntax to use near '' at line 7
MariaDB [cats]> create table employees
    -> (id INT NOT NULL AUTO_INCREMENT,
    -> first_name VARCHAR(255) NOT NULL,
    -> last_name VARCHAR(255) NOT NULL,
    -> middile_name VARCHAR(255),
    -> age INTEGER NOT NULL,
    -> current_status VARCHAR(100) NOT NULL DEFAULT'employed',
    -> PRIMARY KEY(id)
    -> );
Query OK, 0 rows affected (0.13 sec)

MariaDB [cats]> SHOW TABLES employees;
ERROR 1064 (42000): You have an error in your SQL syntax; check the manual that corresponds to your MariaDB server version for the right syntax to use near 'employees' at line 1
MariaDB [cats]> show columns from employees;
+----------------+--------------+------+-----+----------+----------------+
| Field          | Type         | Null | Key | Default  | Extra          |
+----------------+--------------+------+-----+----------+----------------+
| id             | int(11)      | NO   | PRI | NULL     | auto_increment |
| first_name     | varchar(255) | NO   |     | NULL     |                |
| last_name      | varchar(255) | NO   |     | NULL     |                |
| middile_name   | varchar(255) | YES  |     | NULL     |                |
| age            | int(11)      | NO   |     | NULL     |                |
| current_status | varchar(100) | NO   |     | employed |                |
+----------------+--------------+------+-----+----------+----------------+
6 rows in set (0.01 sec)

MariaDB [cats]> show columns from people;
+------------+-------------+------+-----+---------+-------+
| Field      | Type        | Null | Key | Default | Extra |
+------------+-------------+------+-----+---------+-------+
| first_name | varchar(20) | YES  |     | NULL    |       |
| last_name  | varchar(20) | YES  |     | NULL    |       |
| age        | int(11)     | YES  |     | NULL    |       |
+------------+-------------+------+-----+---------+-------+
3 rows in set (0.01 sec)

MariaDB [cats]> show columns from employees;
+----------------+--------------+------+-----+----------+----------------+
| Field          | Type         | Null | Key | Default  | Extra          |
+----------------+--------------+------+-----+----------+----------------+
| id             | int(11)      | NO   | PRI | NULL     | auto_increment |
| first_name     | varchar(255) | NO   |     | NULL     |                |
| last_name      | varchar(255) | NO   |     | NULL     |                |
| middile_name   | varchar(255) | YES  |     | NULL     |                |
| age            | int(11)      | NO   |     | NULL     |                |
| current_status | varchar(100) | NO   |     | employed |                |
+----------------+--------------+------+-----+----------+----------------+
6 rows in set (0.01 sec)

MariaDB [cats]> create database divya;
Query OK, 1 row affected (0.00 sec)

MariaDB [cats]> show tables;
+----------------+
| Tables_in_cats |
+----------------+
| cats           |
| employees      |
| people         |
+----------------+
3 rows in set (0.00 sec)

MariaDB [cats]> show databases;
+--------------------+
| Database           |
+--------------------+
| asha_ff            |
| cats               |
| divya              |
| information_schema |
| mysql              |
| performance_schema |
| phpmyadmin         |
| priya              |
| priyanka           |
| test               |
+--------------------+
10 rows in set (0.00 sec)

MariaDB [cats]> drop database divya;
Query OK, 0 rows affected (0.00 sec)

MariaDB [cats]> show databases;
+--------------------+
| Database           |
+--------------------+
| asha_ff            |
| cats               |
| information_schema |
| mysql              |
| performance_schema |
| phpmyadmin         |
| priya              |
| priyanka           |
| test               |
+--------------------+
9 rows in set (0.00 sec)

MariaDB [cats]> show columns from employees;
+----------------+--------------+------+-----+----------+----------------+
| Field          | Type         | Null | Key | Default  | Extra          |
+----------------+--------------+------+-----+----------+----------------+
| id             | int(11)      | NO   | PRI | NULL     | auto_increment |
| first_name     | varchar(255) | NO   |     | NULL     |                |
| last_name      | varchar(255) | NO   |     | NULL     |                |
| middile_name   | varchar(255) | YES  |     | NULL     |                |
| age            | int(11)      | NO   |     | NULL     |                |
| current_status | varchar(100) | NO   |     | employed |                |
+----------------+--------------+------+-----+----------+----------------+
6 rows in set (0.01 sec)

MariaDB [cats]> CREATE TABLE cats
    ->   (
    ->      cat_id INT NOT NULL AUTO_INCREMENT,
    ->      name   VARCHAR(100),
    ->      breed  VARCHAR(100),
    ->      age    INT,
    ->      PRIMARY KEY (cat_id)
    ->   );
ERROR 1050 (42S01): Table 'cats' already exists
MariaDB [cats]> DROP TABLE Cats;
Query OK, 0 rows affected (0.15 sec)

MariaDB [cats]>
MariaDB [cats]> CREATE TABLE cats
    ->   (
    ->      cat_id INT NOT NULL AUTO_INCREMENT,
    ->      name   VARCHAR(100),
    ->      breed  VARCHAR(100),
    ->      age    INT,
    ->      PRIMARY KEY (cat_id)
    ->   );
Query OK, 0 rows affected (0.20 sec)

MariaDB [cats]> show columns from cats;
+--------+--------------+------+-----+---------+----------------+
| Field  | Type         | Null | Key | Default | Extra          |
+--------+--------------+------+-----+---------+----------------+
| cat_id | int(11)      | NO   | PRI | NULL    | auto_increment |
| name   | varchar(100) | YES  |     | NULL    |                |
| breed  | varchar(100) | YES  |     | NULL    |                |
| age    | int(11)      | YES  |     | NULL    |                |
+--------+--------------+------+-----+---------+----------------+
4 rows in set (0.01 sec)

MariaDB [cats]> INSERT INTO cats(name, breed, age)
    -> VALUES ('Ringo', 'Tabby', 4),
    ->        ('Cindy', 'Maine Coon', 10),
    ->        ('Dumbledore', 'Maine Coon', 11),
    ->        ('Egg', 'Persian', 4),
    ->        ('Misty', 'Tabby', 13),
    ->        ('George Michael', 'Ragdoll', 9),
    ->        ('Jackson', 'Sphynx', 7);
Query OK, 7 rows affected (0.04 sec)
Records: 7  Duplicates: 0  Warnings: 0

MariaDB [cats]> show columns from cats;
+--------+--------------+------+-----+---------+----------------+
| Field  | Type         | Null | Key | Default | Extra          |
+--------+--------------+------+-----+---------+----------------+
| cat_id | int(11)      | NO   | PRI | NULL    | auto_increment |
| name   | varchar(100) | YES  |     | NULL    |                |
| breed  | varchar(100) | YES  |     | NULL    |                |
| age    | int(11)      | YES  |     | NULL    |                |
+--------+--------------+------+-----+---------+----------------+
4 rows in set (0.01 sec)

MariaDB [cats]> select * from cats;
+--------+----------------+------------+------+
| cat_id | name           | breed      | age  |
+--------+----------------+------------+------+
|      1 | Ringo          | Tabby      |    4 |
|      2 | Cindy          | Maine Coon |   10 |
|      3 | Dumbledore     | Maine Coon |   11 |
|      4 | Egg            | Persian    |    4 |
|      5 | Misty          | Tabby      |   13 |
|      6 | George Michael | Ragdoll    |    9 |
|      7 | Jackson        | Sphynx     |    7 |
+--------+----------------+------------+------+
7 rows in set (0.00 sec)

MariaDB [cats]> select name from cats;
+----------------+
| name           |
+----------------+
| Ringo          |
| Cindy          |
| Dumbledore     |
| Egg            |
| Misty          |
| George Michael |
| Jackson        |
+----------------+
7 rows in set (0.00 sec)

MariaDB [cats]> select name frome cats;
ERROR 1064 (42000): You have an error in your SQL syntax; check the manual that corresponds to your MariaDB server version for the right syntax to use near 'cats' at line 1
MariaDB [cats]> select name from cats;
+----------------+
| name           |
+----------------+
| Ringo          |
| Cindy          |
| Dumbledore     |
| Egg            |
| Misty          |
| George Michael |
| Jackson        |
+----------------+
7 rows in set (0.00 sec)

MariaDB [cats]> select*from cats where age=4;
+--------+-------+---------+------+
| cat_id | name  | breed   | age  |
+--------+-------+---------+------+
|      1 | Ringo | Tabby   |    4 |
|      4 | Egg   | Persian |    4 |
+--------+-------+---------+------+
2 rows in set (0.00 sec)

MariaDB [cats]> select *from cats where name="egg";
+--------+------+---------+------+
| cat_id | name | breed   | age  |
+--------+------+---------+------+
|      4 | Egg  | Persian |    4 |
+--------+------+---------+------+
1 row in set (0.00 sec)

MariaDB [cats]> select cat_id from cats;
+--------+
| cat_id |
+--------+
|      1 |
|      2 |
|      3 |
|      4 |
|      5 |
|      6 |
|      7 |
+--------+
7 rows in set (0.00 sec)

MariaDB [cats]> select name,breed from cats;
+----------------+------------+
| name           | breed      |
+----------------+------------+
| Ringo          | Tabby      |
| Cindy          | Maine Coon |
| Dumbledore     | Maine Coon |
| Egg            | Persian    |
| Misty          | Tabby      |
| George Michael | Ragdoll    |
| Jackson        | Sphynx     |
+----------------+------------+
7 rows in set (0.00 sec)

MariaDB [cats]> select name,age from cats where breed="tabby";
+-------+------+
| name  | age  |
+-------+------+
| Ringo |    4 |
| Misty |   13 |
+-------+------+
2 rows in set (0.00 sec)

MariaDB [cats]> select cat_id ,age from cats where cat_id==age;
ERROR 1064 (42000): You have an error in your SQL syntax; check the manual that corresponds to your MariaDB server version for the right syntax to use near '=age' at line 1
MariaDB [cats]> select cat_id,age from cats where cat_id=age;
+--------+------+
| cat_id | age  |
+--------+------+
|      4 |    4 |
|      7 |    7 |
+--------+------+
2 rows in set (0.00 sec)

MariaDB [cats]> select cat_id as id,name from cats;
+----+----------------+
| id | name           |
+----+----------------+
|  1 | Ringo          |
|  2 | Cindy          |
|  3 | Dumbledore     |
|  4 | Egg            |
|  5 | Misty          |
|  6 | George Michael |
|  7 | Jackson        |
+----+----------------+
7 rows in set (0.00 sec)

MariaDB [cats]> update cats set breed="shorthair"
    -> where breed="tabby";
Query OK, 2 rows affected (0.04 sec)
Rows matched: 2  Changed: 2  Warnings: 0

MariaDB [cats]> update cats set breed="shorthair"
    -> where breed="tabby";
Query OK, 0 rows affected (0.00 sec)
Rows matched: 0  Changed: 0  Warnings: 0

MariaDB [cats]> select breed from cats;
+------------+
| breed      |
+------------+
| shorthair  |
| Maine Coon |
| Maine Coon |
| Persian    |
| shorthair  |
| Ragdoll    |
| Sphynx     |
+------------+
7 rows in set (0.00 sec)

MariaDB [cats]> update cats set name="jack"
    -> where name="jakson";
Query OK, 0 rows affected (0.00 sec)
Rows matched: 0  Changed: 0  Warnings: 0

MariaDB [cats]> select names from cats;
ERROR 1054 (42S22): Unknown column 'names' in 'field list'
MariaDB [cats]> select name from cats;
+----------------+
| name           |
+----------------+
| Ringo          |
| Cindy          |
| Dumbledore     |
| Egg            |
| Misty          |
| George Michael |
| Jackson        |
+----------------+
7 rows in set (0.00 sec)

MariaDB [cats]> update cats set age=12
    -> where name="maine Coon";
Query OK, 0 rows affected (0.00 sec)
Rows matched: 0  Changed: 0  Warnings: 0

MariaDB [cats]> select age from cats;
+------+
| age  |
+------+
|    4 |
|   10 |
|   11 |
|    4 |
|   13 |
|    9 |
|    7 |
+------+
7 rows in set (0.00 sec)

MariaDB [cats]> update cats set age=12
    -> where name="Maine Coon";
Query OK, 0 rows affected (0.00 sec)
Rows matched: 0  Changed: 0  Warnings: 0

MariaDB [cats]> select age from cats;
+------+
| age  |
+------+
|    4 |
|   10 |
|   11 |
|    4 |
|   13 |
|    9 |
|    7 |
+------+
7 rows in set (0.00 sec)

MariaDB [cats]> delete from cats where age=4;
Query OK, 2 rows affected (0.05 sec)

MariaDB [cats]>  select age from cats;
+------+
| age  |
+------+
|   10 |
|   11 |
|   13 |
|    9 |
|    7 |
+------+
5 rows in set (0.00 sec)

MariaDB [cats]> select age from cats where age=cat_id;
+------+
| age  |
+------+
|    7 |
+------+
1 row in set (0.00 sec)

MariaDB [cats]> show * from cats;
ERROR 1064 (42000): You have an error in your SQL syntax; check the manual that corresponds to your MariaDB server version for the right syntax to use near '* from cats' at line 1
MariaDB [cats]> show * from cats;
ERROR 1064 (42000): You have an error in your SQL syntax; check the manual that corresponds to your MariaDB server version for the right syntax to use near '* from cats' at line 1
MariaDB [cats]> select * from cats;
+--------+----------------+------------+------+
| cat_id | name           | breed      | age  |
+--------+----------------+------------+------+
|      2 | Cindy          | Maine Coon |   10 |
|      3 | Dumbledore     | Maine Coon |   11 |
|      5 | Misty          | shorthair  |   13 |
|      6 | George Michael | Ragdoll    |    9 |
|      7 | Jackson        | Sphynx     |    7 |
+--------+----------------+------------+------+
5 rows in set (0.00 sec)

MariaDB [cats]> delete age from cats where age=cat_id;
ERROR 1109 (42S02): Unknown table 'age' in MULTI DELETE
MariaDB [cats]> delete from cats where age=cat_id;
Query OK, 1 row affected (0.04 sec)

MariaDB [cats]> select*from cats;
+--------+----------------+------------+------+
| cat_id | name           | breed      | age  |
+--------+----------------+------------+------+
|      2 | Cindy          | Maine Coon |   10 |
|      3 | Dumbledore     | Maine Coon |   11 |
|      5 | Misty          | shorthair  |   13 |
|      6 | George Michael | Ragdoll    |    9 |
+--------+----------------+------------+------+
4 rows in set (0.00 sec)

MariaDB [cats]> select concat(name,breed) from cats;
+-----------------------+
| concat(name,breed)    |
+-----------------------+
| CindyMaine Coon       |
| DumbledoreMaine Coon  |
| Mistyshorthair        |
| George MichaelRagdoll |
+-----------------------+
4 rows in set (0.00 sec)

MariaDB [cats]> select concat(name," ",breed );
ERROR 1054 (42S22): Unknown column 'name' in 'field list'
MariaDB [cats]> select concat(name," ",breed ) from cats;
+-------------------------+
| concat(name," ",breed ) |
+-------------------------+
| Cindy Maine Coon        |
| Dumbledore Maine Coon   |
| Misty shorthair         |
| George Michael Ragdoll  |
+-------------------------+
4 rows in set (0.00 sec)

MariaDB [cats]> select concat("_",name,breed) from cats;
+------------------------+
| concat("_",name,breed) |
+------------------------+
| _CindyMaine Coon       |
| _DumbledoreMaine Coon  |
| _Mistyshorthair        |
| _George MichaelRagdoll |
+------------------------+
4 rows in set (0.00 sec)

MariaDB [cats]> select concat_ws("_",name,breed) from cats;
+---------------------------+
| concat_ws("_",name,breed) |
+---------------------------+
| Cindy_Maine Coon          |
| Dumbledore_Maine Coon     |
| Misty_shorthair           |
| George Michael_Ragdoll    |
+---------------------------+
4 rows in set (0.00 sec)

MariaDB [cats]> select substring(name,1,3) from cats;
+---------------------+
| substring(name,1,3) |
+---------------------+
| Cin                 |
| Dum                 |
| Mis                 |
| Geo                 |
+---------------------+
4 rows in set (0.00 sec)

MariaDB [cats]> select substring(name,-3) from cats;
+--------------------+
| substring(name,-3) |
+--------------------+
| ndy                |
| ore                |
| sty                |
| ael                |
+--------------------+
4 rows in set (0.00 sec)

MariaDB [cats]> select reverse(name) from cats;
+----------------+
| reverse(name)  |
+----------------+
| ydniC          |
| erodelbmuD     |
| ytsiM          |
| leahciM egroeG |
+----------------+
4 rows in set (0.00 sec)

MariaDB [cats]> select name from cats where char_lenght(name=3);
ERROR 1305 (42000): FUNCTION cats.char_lenght does not exist
MariaDB [cats]> select name from cats where char_length(name)=3;
Empty set (0.00 sec)

MariaDB [cats]> select name from cats where char_length(name)=5;
+-------+
| name  |
+-------+
| Cindy |
| Misty |
+-------+
2 rows in set (0.00 sec)

MariaDB [cats]> show databases;
+--------------------+
| Database           |
+--------------------+
| asha_ff            |
| cats               |
| information_schema |
| mysql              |
| performance_schema |
| phpmyadmin         |
| priya              |
| priyanka           |
| test               |
+--------------------+
9 rows in set (0.00 sec)

MariaDB [cats]> show * from cats;
ERROR 1064 (42000): You have an error in your SQL syntax; check the manual that corresponds to your MariaDB server version for the right syntax to use near '* from cats' at line 1
MariaDB [cats]> select * from cats;
+--------+----------------+------------+------+
| cat_id | name           | breed      | age  |
+--------+----------------+------------+------+
|      2 | Cindy          | Maine Coon |   10 |
|      3 | Dumbledore     | Maine Coon |   11 |
|      5 | Misty          | shorthair  |   13 |
|      6 | George Michael | Ragdoll    |    9 |
+--------+----------------+------------+------+
4 rows in set (0.00 sec)

MariaDB [cats]> select lower(name) from cats;
+----------------+
| lower(name)    |
+----------------+
| cindy          |
| dumbledore     |
| misty          |
| george michael |
+----------------+
4 rows in set (0.00 sec)

MariaDB [cats]> select lower(breed) from cats;
+--------------+
| lower(breed) |
+--------------+
| maine coon   |
| maine coon   |
| shorthair    |
| ragdoll      |
+--------------+
4 rows in set (0.00 sec)

MariaDB [cats]> select uooer
    -> 0
    -> ;
ERROR 1064 (42000): You have an error in your SQL syntax; check the manual that corresponds to your MariaDB server version for the right syntax to use near '0' at line 2
MariaDB [cats]> select distinct breed from cats;
+------------+
| breed      |
+------------+
| Maine Coon |
| shorthair  |
| Ragdoll    |
+------------+
3 rows in set (0.00 sec)

MariaDB [cats]> select * from cats order by name;
+--------+----------------+------------+------+
| cat_id | name           | breed      | age  |
+--------+----------------+------------+------+
|      2 | Cindy          | Maine Coon |   10 |
|      3 | Dumbledore     | Maine Coon |   11 |
|      6 | George Michael | Ragdoll    |    9 |
|      5 | Misty          | shorthair  |   13 |
+--------+----------------+------------+------+
4 rows in set (0.00 sec)

MariaDB [cats]> select * from cats order by age;
+--------+----------------+------------+------+
| cat_id | name           | breed      | age  |
+--------+----------------+------------+------+
|      6 | George Michael | Ragdoll    |    9 |
|      2 | Cindy          | Maine Coon |   10 |
|      3 | Dumbledore     | Maine Coon |   11 |
|      5 | Misty          | shorthair  |   13 |
+--------+----------------+------------+------+
4 rows in set (0.00 sec)

MariaDB [cats]> select * from cats order by age desc;
+--------+----------------+------------+------+
| cat_id | name           | breed      | age  |
+--------+----------------+------------+------+
|      5 | Misty          | shorthair  |   13 |
|      3 | Dumbledore     | Maine Coon |   11 |
|      2 | Cindy          | Maine Coon |   10 |
|      6 | George Michael | Ragdoll    |    9 |
+--------+----------------+------------+------+
4 rows in set (0.00 sec)

MariaDB [cats]> select *from cats order by age,name;
+--------+----------------+------------+------+
| cat_id | name           | breed      | age  |
+--------+----------------+------------+------+
|      6 | George Michael | Ragdoll    |    9 |
|      2 | Cindy          | Maine Coon |   10 |
|      3 | Dumbledore     | Maine Coon |   11 |
|      5 | Misty          | shorthair  |   13 |
+--------+----------------+------------+------+
4 rows in set (0.00 sec)

MariaDB [cats]> select * from cats limit 3;
+--------+------------+------------+------+
| cat_id | name       | breed      | age  |
+--------+------------+------------+------+
|      2 | Cindy      | Maine Coon |   10 |
|      3 | Dumbledore | Maine Coon |   11 |
|      5 | Misty      | shorthair  |   13 |
+--------+------------+------------+------+
3 rows in set (0.00 sec)

MariaDB [cats]> select * from cats limit 0,2;
+--------+------------+------------+------+
| cat_id | name       | breed      | age  |
+--------+------------+------------+------+
|      2 | Cindy      | Maine Coon |   10 |
|      3 | Dumbledore | Maine Coon |   11 |
+--------+------------+------------+------+
2 rows in set (0.00 sec)

MariaDB [cats]> select * from cats limit 2,4;
+--------+----------------+-----------+------+
| cat_id | name           | breed     | age  |
+--------+----------------+-----------+------+
|      5 | Misty          | shorthair |   13 |
|      6 | George Michael | Ragdoll   |    9 |
+--------+----------------+-----------+------+
2 rows in set (0.00 sec)

MariaDB [cats]> select from cats where name like"%du%";
ERROR 1064 (42000): You have an error in your SQL syntax; check the manual that corresponds to your MariaDB server version for the right syntax to use near 'from cats where name like"%du%"' at line 1
MariaDB [cats]> select * from cats where name like"%i%";
+--------+----------------+------------+------+
| cat_id | name           | breed      | age  |
+--------+----------------+------------+------+
|      2 | Cindy          | Maine Coon |   10 |
|      5 | Misty          | shorthair  |   13 |
|      6 | George Michael | Ragdoll    |    9 |
+--------+----------------+------------+------+
3 rows in set (0.00 sec)

MariaDB [cats]> select * from cats where name like"mi%";
+--------+-------+-----------+------+
| cat_id | name  | breed     | age  |
+--------+-------+-----------+------+
|      5 | Misty | shorthair |   13 |
+--------+-------+-----------+------+
1 row in set (0.00 sec)

MariaDB [cats]> select count(*) from cats;
+----------+
| count(*) |
+----------+
|        4 |
+----------+
1 row in set (0.00 sec)

MariaDB [cats]> select count(distinct breed) from cats;
+-----------------------+
| count(distinct breed) |
+-----------------------+
|                     3 |
+-----------------------+
1 row in set (0.00 sec)

MariaDB [cats]> select count(*) from cats where name like "%mi%";
+----------+
| count(*) |
+----------+
|        2 |
+----------+
1 row in set (0.00 sec)

MariaDB [cats]> select * from ctas;
ERROR 1146 (42S02): Table 'cats.ctas' doesn't exist
MariaDB [cats]> select * from cats;
+--------+----------------+------------+------+
| cat_id | name           | breed      | age  |
+--------+----------------+------------+------+
|      2 | Cindy          | Maine Coon |   10 |
|      3 | Dumbledore     | Maine Coon |   11 |
|      5 | Misty          | shorthair  |   13 |
|      6 | George Michael | Ragdoll    |    9 |
+--------+----------------+------------+------+
4 rows in set (0.00 sec)

MariaDB [cats]> select breed,count(*) from cats group by breed;
+------------+----------+
| breed      | count(*) |
+------------+----------+
| Maine Coon |        2 |
| Ragdoll    |        1 |
| shorthair  |        1 |
+------------+----------+
3 rows in set (0.00 sec)

MariaDB [cats]> select min
    -> ;l
ERROR 1054 (42S22): Unknown column 'min' in 'field list'
    ->
    -> jh;
ERROR 1064 (42000): You have an error in your SQL syntax; check the manual that corresponds to your MariaDB server version for the right syntax to use near 'l

jh' at line 1
MariaDB [cats]> select name,min(age) from cats;
+-------+----------+
| name  | min(age) |
+-------+----------+
| Cindy |        9 |
+-------+----------+
1 row in set (0.00 sec)

MariaDB [cats]> select name,max(age) from cats;
+-------+----------+
| name  | max(age) |
+-------+----------+
| Cindy |       13 |
+-------+----------+
1 row in set (0.00 sec)

MariaDB [cats]> select max(age),name from cats;
+----------+-------+
| max(age) | name  |
+----------+-------+
|       13 | Cindy |
+----------+-------+
1 row in set (0.00 sec)

MariaDB [cats]> select * from cats where age=(select min(age) from cats);
+--------+----------------+---------+------+
| cat_id | name           | breed   | age  |
+--------+----------------+---------+------+
|      6 | George Michael | Ragdoll |    9 |
+--------+----------------+---------+------+
1 row in set (0.00 sec)

MariaDB [cats]> select * from cats where age=(select max(age) from cats);
+--------+-------+-----------+------+
| cat_id | name  | breed     | age  |
+--------+-------+-----------+------+
|      5 | Misty | shorthair |   13 |
+--------+-------+-----------+------+
1 row in set (0.00 sec)

MariaDB [cats]> select * from cats order by age limit 2;
+--------+----------------+------------+------+
| cat_id | name           | breed      | age  |
+--------+----------------+------------+------+
|      6 | George Michael | Ragdoll    |    9 |
|      2 | Cindy          | Maine Coon |   10 |
+--------+----------------+------------+------+
2 rows in set (0.00 sec)

MariaDB [cats]> Bye
Ctrl-C -- exit!

C:\xampp\mysql\bin>